{
  "$schema": "https://json-schema.org/draft/2020-12/schema",
  "$id": "https://eleveniq.local/contract/v1/group.schema.json",
  "title": "groups/<group>.json",
  "description": "What every row of a position group shares per metric, in registry metric order (the index matches a player file's metrics array).",
  "type": "object", "additionalProperties": false, "required": ["stamps", "group", "metrics", "defending_note"],
  "properties": {
    "stamps": {"$ref": "common.schema.json#/$defs/stamps"},
    "group": {"$ref": "common.schema.json#/$defs/anyGroup"},
    "defending_note": {"type": ["string", "null"], "description": "The sentence shown with a withheld Defending score (ADR 004 §14 N2 / N3)."},
    "metrics": {
      "type": "array",
      "items": {
        "type": "object", "additionalProperties": false,
        "required": ["metric", "label", "family", "order", "direction", "direction_text", "registry_status",
                     "uncoloured", "gap_eligible", "notes", "reasons", "withheld_tag"],
        "properties": {
          "metric": {"type": "string"}, "label": {"type": "string"}, "family": {"type": "string"},
          "order": {"type": "integer", "minimum": 0},
          "direction": {"enum": ["higher_better", "lower_better", "style"]},
          "direction_text": {"type": "string"},
          "registry_status": {"type": ["string", "null"]},
          "uncoloured": {"type": "boolean"},
          "gap_eligible": {"type": "boolean", "description": "May headline compare mode's top-6 gap list (user, 2026-10-09, option c): not a signature trait, not associated with team possession, not long pass completion. The site also needs a percentile on both rows."},
          "notes": {"type": "array", "items": {"$ref": "common.schema.json#/$defs/noteText"}},
          "reasons": {"type": ["string", "null"], "description": "Why a non-DNA metric is display-only, as registry reason text."},
          "withheld_tag": {"type": ["string", "null"], "description": "\"(<Family> score withheld: <reason>)\" when the metric's family score is withheld in this group."}
        }
      }
    }
  }
}
