{"stamps":{"contract_version":"1.0.0","registry_version":"b9762e99fa2b5f9696b8f21793b9421002a3039de27c28f7373d8857f64f4e26","measurement_source":"statsbomb","source":"statsbomb","season_ids":[27],"season_parquet_sha256":"572ee7948d2fc89a7ff7bea3e6db0abd6308b767f06cf6f9ba58bf79dc82b7f0","percentiles_parquet_sha256":"71dd579ffe7916a7a3ea401a42965d8c2ebb22c0dee12ddd2df27a79deed6003","dna_parquet_sha256":"476bf4fabf14907a2d8fc50f41da63d6371565a072ab2fb2f70c37c9044d5664","positions_parquet_sha256":"a19975bb2bfef9d984eeace3b7c2485690d99c38f1d18a8c3355accd91e1b68e","match_parquet_sha256":"6c97bb09c00046246f956abbe41064655920b0cb272ee7bbc5e2c8ef9b08ac9b"},"group":"CB","metrics":[{"metric":"pass_completion_pct","label":"Pass completion","family":"Passing","order":0,"direction":"higher_better","direction_text":"higher better","registry_status":"display","uncoloured":true,"gap_eligible":false,"notes":[],"reasons":"associated with team possession in most leagues, associated with team possession at or above the possession-check level","withheld_tag":"(Passing score withheld: rests on long pass completion alone)"},{"metric":"long_pass_completion_pct","label":"Long pass completion","family":"Passing","order":1,"direction":"higher_better","direction_text":"no good/poor reading","registry_status":"dna","uncoloured":true,"gap_eligible":false,"notes":[{"short":"not read as good or poor passing","full":"associated with team possession for centre-backs, full-backs and central midfielders, and not shown to follow the player across clubs (club-mover test inconclusive, underpowered); it is not read as good or poor individual passing"},{"short":"associated with team possession","full":"associated with team possession at or above the possession-check level; kept in the profile by a recorded decision"}],"reasons":null,"withheld_tag":"(Passing score withheld: rests on long pass completion alone)"},{"metric":"long_passes_attempted_p90","label":"Long passes","family":"Passing","order":2,"direction":"style","direction_text":"style","registry_status":"dna","uncoloured":true,"gap_eligible":true,"notes":[],"reasons":null,"withheld_tag":"(Passing score withheld: rests on long pass completion alone)"},{"metric":"team_pass_share","label":"Share of team open-play passes","family":"Passing","order":3,"direction":"style","direction_text":"style","registry_status":"display","uncoloured":true,"gap_eligible":true,"notes":[],"reasons":"team pass share is judged by its own stricter possession check","withheld_tag":"(Passing score withheld: rests on long pass completion alone)"},{"metric":"passes_attempted_p90","label":"Passes attempted","family":"Passing","order":4,"direction":"style","direction_text":"style","registry_status":"display","uncoloured":true,"gap_eligible":false,"notes":[],"reasons":null,"withheld_tag":"(Passing score withheld: rests on long pass completion alone)"},{"metric":"passes_completed_p90","label":"Passes completed","family":"Passing","order":5,"direction":"style","direction_text":"style","registry_status":"display","uncoloured":true,"gap_eligible":false,"notes":[],"reasons":null,"withheld_tag":"(Passing score withheld: rests on long pass completion alone)"},{"metric":"switches_p90","label":"Switches of play","family":"Passing","order":6,"direction":"style","direction_text":"style","registry_status":"display","uncoloured":true,"gap_eligible":true,"notes":[],"reasons":null,"withheld_tag":"(Passing score withheld: rests on long pass completion alone)"},{"metric":"progressive_passes_p90","label":"Progressive passes","family":"Progression","order":7,"direction":"higher_better","direction_text":"higher better","registry_status":"dna","uncoloured":true,"gap_eligible":false,"notes":[{"short":"associated with team possession","full":"associated with team possession at or above the possession-check level; kept in the profile by a recorded decision"}],"reasons":null,"withheld_tag":null},{"metric":"final_third_entries_pass_p90","label":"Final-third entries (pass)","family":"Progression","order":8,"direction":"higher_better","direction_text":"higher better","registry_status":"dna","uncoloured":false,"gap_eligible":true,"notes":[],"reasons":null,"withheld_tag":null},{"metric":"box_entries_pass_p90","label":"Box entries (pass)","family":"Progression","order":9,"direction":"higher_better","direction_text":"higher better","registry_status":"dna","uncoloured":false,"gap_eligible":true,"notes":[],"reasons":null,"withheld_tag":null},{"metric":"progressive_carries_p90","label":"Progressive carries","family":"Carrying","order":10,"direction":"higher_better","direction_text":"higher better","registry_status":"dna","uncoloured":true,"gap_eligible":false,"notes":[{"short":"associated with team possession","full":"associated with team possession at or above the possession-check level; kept in the profile by a recorded decision"}],"reasons":null,"withheld_tag":null},{"metric":"final_third_entries_carry_p90","label":"Final-third entries (carry)","family":"Carrying","order":11,"direction":"higher_better","direction_text":"higher better","registry_status":"dna","uncoloured":false,"gap_eligible":true,"notes":[],"reasons":null,"withheld_tag":null},{"metric":"box_entries_carry_p90","label":"Box entries (carry)","family":"Carrying","order":12,"direction":"higher_better","direction_text":"higher better","registry_status":"display","uncoloured":false,"gap_eligible":true,"notes":[],"reasons":"many players record none, so it is not ranked as a profile metric, not stable enough between two halves of a player's matches to profile a player","withheld_tag":null},{"metric":"dribbles_attempted_p90","label":"Dribbles attempted","family":"Carrying","order":13,"direction":"style","direction_text":"style","registry_status":"dna","uncoloured":true,"gap_eligible":true,"notes":[{"short":"lower reliability","full":"lower reliability"}],"reasons":null,"withheld_tag":null},{"metric":"dribbles_completed_p90","label":"Dribbles completed","family":"Carrying","order":14,"direction":"higher_better","direction_text":"higher better","registry_status":"display","uncoloured":false,"gap_eligible":true,"notes":[],"reasons":"left out: ranks players almost the same as another DNA metric","withheld_tag":null},{"metric":"dribble_success_pct","label":"Dribble success","family":"Carrying","order":15,"direction":"higher_better","direction_text":"higher better","registry_status":"display","uncoloured":false,"gap_eligible":true,"notes":[],"reasons":null,"withheld_tag":null},{"metric":"carries_p90","label":"Carries","family":"Carrying","order":16,"direction":"style","direction_text":"style","registry_status":"display","uncoloured":true,"gap_eligible":false,"notes":[],"reasons":null,"withheld_tag":null},{"metric":"fouls_won_p90","label":"Fouls won","family":"Carrying","order":17,"direction":"style","direction_text":"style","registry_status":"dna","uncoloured":true,"gap_eligible":true,"notes":[{"short":"lower reliability","full":"lower reliability"}],"reasons":null,"withheld_tag":null},{"metric":"op_key_passes_p90","label":"Key passes (non-restart delivery)","family":"Creation","order":18,"direction":"higher_better","direction_text":"higher better","registry_status":"display","uncoloured":false,"gap_eligible":true,"notes":[],"reasons":"not stable enough between two halves of a player's matches to profile a player","withheld_tag":null},{"metric":"op_xg_assisted_p90","label":"xG assisted (non-restart delivery)","family":"Creation","order":19,"direction":"higher_better","direction_text":"higher better","registry_status":"display","uncoloured":false,"gap_eligible":true,"notes":[],"reasons":"not stable enough between two halves of a player's matches to profile a player","withheld_tag":null},{"metric":"key_passes_p90","label":"Key passes (all)","family":"Creation","order":20,"direction":"higher_better","direction_text":"higher better","registry_status":"display","uncoloured":false,"gap_eligible":true,"notes":[],"reasons":null,"withheld_tag":null},{"metric":"xg_assisted_p90","label":"xG assisted (all)","family":"Creation","order":21,"direction":"higher_better","direction_text":"higher better","registry_status":"display","uncoloured":false,"gap_eligible":true,"notes":[],"reasons":null,"withheld_tag":null},{"metric":"xg_assisted_direct_p90","label":"xG assisted (direct)","family":"Creation","order":22,"direction":"higher_better","direction_text":"higher better","registry_status":"display","uncoloured":false,"gap_eligible":true,"notes":[],"reasons":null,"withheld_tag":null},{"metric":"crosses_attempted_p90","label":"Crosses","family":"Creation","order":23,"direction":"style","direction_text":"style","registry_status":"display","uncoloured":true,"gap_eligible":true,"notes":[],"reasons":null,"withheld_tag":null},{"metric":"cross_completion_pct","label":"Cross completion","family":"Creation","order":24,"direction":"higher_better","direction_text":"higher better","registry_status":"display","uncoloured":false,"gap_eligible":true,"notes":[],"reasons":null,"withheld_tag":null},{"metric":"op_assists_p90","label":"Assists (non-restart delivery)","family":"Creation","order":25,"direction":"higher_better","direction_text":"higher better","registry_status":"display","uncoloured":false,"gap_eligible":true,"notes":[],"reasons":null,"withheld_tag":null},{"metric":"assists_p90","label":"Assists","family":"Creation","order":26,"direction":"higher_better","direction_text":"higher better","registry_status":"display","uncoloured":false,"gap_eligible":true,"notes":[],"reasons":null,"withheld_tag":null},{"metric":"restart_key_passes_p90","label":"Restart key passes (corners, free kicks, throw-ins)","family":"Creation","order":27,"direction":"higher_better","direction_text":"higher better","registry_status":"signature","uncoloured":false,"gap_eligible":false,"notes":[{"short":"restart deliveries include throw-ins","full":"restart deliveries include throw-ins (5.6% of restart key passes), so long-throw specialists score slightly higher"}]